,code,met,heading,activity,intensity
685,19150,4.3,winter activities,"skiing, downhill, alpine or snowboarding, light effort, active time only",2
686,19160,5.3,winter activities,"skiing, downhill, alpine or snowboarding, moderate effort, general, active time only",2
687,19170,8,winter activities,"skiing, downhill, vigorous effort, racing",3
688,19175,12.5,winter activities,"skiing, roller, elite racers",3
689,19180,7,winter activities,"sledding, tobogganing, bobsledding, luge (Taylor Code 370)",3
690,19190,5.3,winter activities,"snow shoeing, moderate effort",2
691,19192,10,winter activities,"snow shoeing, vigorous effort",3
692,19200,3.5,winter activities,"snowmobiling, driving, moderate",2
693,19202,2,winter activities,"snowmobiling, passenger",1
694,19252,5.3,winter activities,"snow shoveling, by hand, moderate effort",2
695,19254,7.5,winter activities,"snow shoveling, by hand, vigorous effort",3
696,19260,2.5,winter activities,"snow blower, walking and pushing",1
697,20000,1.3,religious activities,"sitting in church, in service, attending a ceremony, sitting quietly",1
698,20001,2,religious activities,"sitting, playing an instrument at church",1
699,20005,1.8,religious activities,"sitting in church, talking or singing, attending a ceremony, sitting, active participation",1
700,20010,1.3,religious activities,"sitting, reading religious materials at home",1
701,20015,1.3,religious activities,"standing quietly in church, attending a ceremony",1
702,20020,2,religious activities,"standing, singing in church, attending a ceremony, standing, active participation",1
703,20025,1.3,religious activities,"kneeling in church or at home, praying",1
704,20030,1.8,religious activities,"standing, talking in church",1
705,20035,2,religious activities,walking in church,1
706,20036,2,religious activities,"walking, less than 2.0 mph, very slow",1
707,20037,3.5,religious activities,"walking, 3.0 mph, moderate speed, not carrying anything",2
708,20038,4.3,religious activities,"walking, 3.5 mph, brisk speed, not carrying anything",2
709,20039,2,religious activities,"walk/stand combination for religious purposes, usher",1
710,20040,5,religious activities,"praise with dance or run, spiritual dancing in church",2
711,20045,2.5,religious activities,serving food at church,1
712,20046,2,religious activities,preparing food at church,1
713,20047,3.3,religious activities,"washing dishes, cleaning kitchen at church",2
714,20050,1.5,religious activities,eating at church,1
715,20055,2,religious activities,"eating/talking at church or standing eating, American Indian Feast days",1
716,20060,3.3,religious activities,cleaning church,2
717,20061,4,religious activities,general yard work at church,2
718,20065,3.5,religious activities,"standing, moderate effort (e.g., lifting heavy objects, assembling at fast rate)",2
719,20095,4.5,religious activities,"Standing, moderate-to-heavy effort, manual labor, lifting ≥ 50 lbs, heavy maintenance",2
720,20100,1.3,religious activities,"typing, electric, manual, or computer",1
721,21000,1.5,volunteer activities,"sitting, meeting, general, and/or with talking involved",1
722,21005,1.5,volunteer activities,"sitting, light office work, in general",1
723,21010,2.5,volunteer activities,"sitting, moderate work",1
724,21015,2.3,volunteer activities,"standing, light work (filing, talking, assembling)",1
725,21016,2,volunteer activities,"sitting, child care, only active periods",1
726,21017,3,volunteer activities,"standing, child care, only active periods",2
727,21018,3.5,volunteer activities,"walk/run play with children, moderate, only active periods",2
728,21019,5.8,volunteer activities,"walk/run play with children, vigorous, only active periods",2
729,21020,3,volunteer activities,"standing, light/moderate work (e.g., pack boxes, assemble/repair, set up chairs/furniture)",2
730,21025,3.5,volunteer activities,"standing, moderate (lifting 50 lbs., assembling at fast rate)",2
731,21030,4.5,volunteer activities,"standing, moderate/heavy work",2
732,21035,1.3,volunteer activities,"typing, electric, manual, or computer",1
733,21040,2,volunteer activities,"walking, less than 2.0 mph, very slow",1
734,21045,3.5,volunteer activities,"walking, 3.0 mph, moderate speed, not carrying anything",2
735,21050,4.3,volunteer activities,"walking, 3.5 mph, brisk speed, not carrying anything",2
736,21055,3.5,volunteer activities,"walking, 2.5 mph slowly and carrying objects less than 25 lbs",2
737,21060,4.5,volunteer activities,"walking, 3.0 mph moderately and carrying objects less than 25 lbs, pushing something",2
738,21065,4.8,volunteer activities,"walking, 3.5 mph, briskly and carrying objects less than 25 lbs",2
739,21070,3,volunteer activities,"walk/stand combination, for volunteer purposes",2
